{
  "analysis_version": 1,
  "claim_scope": "The recorded trajectory contains a localized discontinuity that is better fit by an impulse model; ball tracking alone does not identify its cause.",
  "source": {
    "file": "data/incident_ball_track.csv",
    "source_timeline_origin_ms": 1783806352112,
    "kick_timestamp_ms": 1783806435336,
    "flight_end_timestamp_ms": 1783806439420,
    "sample_count": 205,
    "duration_s": 4.084,
    "displayed_cable_alignment_timestamp_ms": 1783806437162,
    "displayed_cable_alignment_is_measured": false
  },
  "method": {
    "acceleration": "gravity - k*|v|*v + |v|*(w cross v)",
    "integrator": "RK4 at recorded timestamps; 20 ms for continuation",
    "models": {
      "A": "constant drag and constant Magnus vector",
      "B": "A with exponential Magnus decay",
      "C": "A with one velocity impulse at a discrete sample boundary",
      "D": "B with one velocity impulse at the model-C selected boundary"
    },
    "impulse_time_selection": "0.2 s coarse grid followed by every native sample boundary within 0.25 s of the coarse minimum; continuous parameters are refitted at each time",
    "optimizer": "SciPy nonlinear least squares, Levenberg-Marquardt",
    "formal_confidence_interval_available": false,
    "formal_confidence_interval_reason": "The delivered source did not include sensor covariance or filtering metadata."
  },
  "results": {
    "model_rms_cm": {
      "A": 18.2,
      "B": 15.46,
      "C": 7.364,
      "D": 5.77
    },
    "selected_impulse_time_from_kick_s": 1.921,
    "selected_impulse_timestamp_ms": 1783806437257,
    "impulse_vector_mps": [
      -1.0839,
      0.277,
      0.3471
    ],
    "impulse_magnitude_mps": 1.1713,
    "model_d_impulse_vector_mps": [
      -0.9128,
      0.199,
      0.5049
    ],
    "model_d_impulse_magnitude_mps": 1.062,
    "drag_coefficient": 0.369397,
    "lift_coefficient": 0.364869,
    "launch_speed_mps": 33.8697,
    "launch_elevation_deg": 20.4577,
    "observed_interruption": [
      3.2874,
      -26.7426,
      0.88
    ],
    "model_at_same_height": [
      5.257,
      -27.3833,
      0.88
    ],
    "same_height_time_from_kick_s": 4.104,
    "same_height_horizontal_miss_m": 2.0711,
    "continuation_window_m": 3.0,
    "continuation_start_time_from_kick_s": 3.863,
    "continuation_velocity_mps": [
      7.4857,
      -4.0598,
      -13.1432
    ],
    "extrapolated_touchdown_time_from_kick_s": 4.1414,
    "extrapolated_touchdown": [
      3.7168,
      -26.9755,
      0.11
    ],
    "no_impulse_touchdown_time_from_kick_s": 4.1675,
    "no_impulse_touchdown": [
      5.7952,
      -27.6658,
      0.11
    ],
    "touchdown_horizontal_miss_m": 2.1901
  },
  "impulse_time_sensitivity": [
    {
      "time_from_kick_s": 0.8,
      "source_timestamp_ms": 1783806436136,
      "rms_cm": 10.88,
      "impulse_mps": 1.9086
    },
    {
      "time_from_kick_s": 1.0,
      "source_timestamp_ms": 1783806436336,
      "rms_cm": 11.568,
      "impulse_mps": 1.6556
    },
    {
      "time_from_kick_s": 1.2,
      "source_timestamp_ms": 1783806436536,
      "rms_cm": 12.516,
      "impulse_mps": 1.4713
    },
    {
      "time_from_kick_s": 1.4,
      "source_timestamp_ms": 1783806436736,
      "rms_cm": 12.421,
      "impulse_mps": 1.3532
    },
    {
      "time_from_kick_s": 1.6,
      "source_timestamp_ms": 1783806436936,
      "rms_cm": 10.644,
      "impulse_mps": 1.3093
    },
    {
      "time_from_kick_s": 1.8,
      "source_timestamp_ms": 1783806437136,
      "rms_cm": 7.894,
      "impulse_mps": 1.2518
    },
    {
      "time_from_kick_s": 2.0,
      "source_timestamp_ms": 1783806437336,
      "rms_cm": 7.577,
      "impulse_mps": 1.1072
    },
    {
      "time_from_kick_s": 2.2,
      "source_timestamp_ms": 1783806437536,
      "rms_cm": 8.477,
      "impulse_mps": 0.9746
    },
    {
      "time_from_kick_s": 2.4,
      "source_timestamp_ms": 1783806437736,
      "rms_cm": 9.306,
      "impulse_mps": 0.8962
    },
    {
      "time_from_kick_s": 2.6,
      "source_timestamp_ms": 1783806437936,
      "rms_cm": 10.077,
      "impulse_mps": 0.8738
    },
    {
      "time_from_kick_s": 2.8,
      "source_timestamp_ms": 1783806438136,
      "rms_cm": 10.787,
      "impulse_mps": 0.9295
    },
    {
      "time_from_kick_s": 3.0,
      "source_timestamp_ms": 1783806438336,
      "rms_cm": 11.563,
      "impulse_mps": 1.0238
    },
    {
      "time_from_kick_s": 3.2,
      "source_timestamp_ms": 1783806438536,
      "rms_cm": 12.509,
      "impulse_mps": 1.0762
    },
    {
      "time_from_kick_s": 3.4,
      "source_timestamp_ms": 1783806438736,
      "rms_cm": 13.593,
      "impulse_mps": 1.2168
    },
    {
      "time_from_kick_s": 3.6,
      "source_timestamp_ms": 1783806438936,
      "rms_cm": 14.811,
      "impulse_mps": 1.5343
    }
  ],
  "recorded_flight": [
    [
      0.0,
      -45.6355,
      -6.3132,
      0.8
    ],
    [
      0.02,
      -45.0474,
      -6.4833,
      1.05
    ],
    [
      0.04,
      -44.4802,
      -6.6533,
      1.29
    ],
    [
      0.06,
      -43.913,
      -6.8234,
      1.53
    ],
    [
      0.08,
      -43.3564,
      -6.9935,
      1.78
    ],
    [
      0.1,
      -42.8102,
      -7.1636,
      2.01
    ],
    [
      0.12,
      -42.2746,
      -7.3336,
      2.26
    ],
    [
      0.14,
      -41.7389,
      -7.5037,
      2.5
    ],
    [
      0.16,
      -41.2138,
      -7.667,
      2.74
    ],
    [
      0.18,
      -40.7096,
      -7.8235,
      2.97
    ],
    [
      0.2,
      -40.195,
      -7.9935,
      3.21
    ],
    [
      0.22,
      -39.7013,
      -8.1568,
      3.44
    ],
    [
      0.24,
      -39.2077,
      -8.3133,
      3.67
    ],
    [
      0.26,
      -38.7246,
      -8.4765,
      3.9
    ],
    [
      0.28,
      -38.2414,
      -8.633,
      4.14
    ],
    [
      0.3,
      -37.7898,
      -8.7827,
      4.37
    ],
    [
      0.32,
      -37.3277,
      -8.9459,
      4.6
    ],
    [
      0.34,
      -36.8655,
      -9.0956,
      4.82
    ],
    [
      0.36,
      -36.4139,
      -9.2521,
      5.05
    ],
    [
      0.38,
      -35.9728,
      -9.4154,
      5.27
    ],
    [
      0.4,
      -35.5422,
      -9.565,
      5.5
    ],
    [
      0.42,
      -35.1115,
      -9.7147,
      5.72
    ],
    [
      0.44,
      -34.6914,
      -9.8575,
      5.93
    ],
    [
      0.46,
      -34.2818,
      -10.0072,
      6.14
    ],
    [
      0.48,
      -33.8722,
      -10.1569,
      6.36
    ],
    [
      0.5,
      -33.4731,
      -10.2929,
      6.57
    ],
    [
      0.52,
      -33.0739,
      -10.4358,
      6.78
    ],
    [
      0.54,
      -32.6748,
      -10.5855,
      6.99
    ],
    [
      0.56,
      -32.2967,
      -10.7283,
      7.2
    ],
    [
      0.58,
      -31.9081,
      -10.8644,
      7.4
    ],
    [
      0.6,
      -31.53,
      -11.0073,
      7.6
    ],
    [
      0.62,
      -31.1519,
      -11.1365,
      7.8
    ],
    [
      0.64,
      -30.7843,
      -11.2658,
      8.0
    ],
    [
      0.66,
      -30.4272,
      -11.395,
      8.2
    ],
    [
      0.68,
      -30.0701,
      -11.5379,
      8.39
    ],
    [
      0.7,
      -29.713,
      -11.6671,
      8.58
    ],
    [
      0.72,
      -29.3769,
      -11.7964,
      8.77
    ],
    [
      0.74,
      -29.0303,
      -11.9121,
      8.95
    ],
    [
      0.76,
      -28.6837,
      -12.0345,
      9.14
    ],
    [
      0.78,
      -28.3581,
      -12.1638,
      9.33
    ],
    [
      0.8,
      -28.0115,
      -12.2862,
      9.53
    ],
    [
      0.82,
      -27.6859,
      -12.4155,
      9.71
    ],
    [
      0.84,
      -27.3603,
      -12.5379,
      9.9
    ],
    [
      0.86,
      -27.0452,
      -12.6536,
      10.08
    ],
    [
      0.88,
      -26.7406,
      -12.7556,
      10.23
    ],
    [
      0.9,
      -26.4361,
      -12.8645,
      10.39
    ],
    [
      0.92,
      -26.121,
      -12.9869,
      10.55
    ],
    [
      0.941,
      -25.8269,
      -13.0822,
      10.7
    ],
    [
      0.961,
      -25.5328,
      -13.2046,
      10.86
    ],
    [
      0.981,
      -25.2387,
      -13.3135,
      11.02
    ],
    [
      1.001,
      -24.9446,
      -13.4155,
      11.16
    ],
    [
      1.021,
      -24.661,
      -13.5244,
      11.3
    ],
    [
      1.041,
      -24.3775,
      -13.6468,
      11.45
    ],
    [
      1.061,
      -24.0834,
      -13.7557,
      11.62
    ],
    [
      1.081,
      -23.7998,
      -13.8645,
      11.77
    ],
    [
      1.101,
      -23.5267,
      -13.9734,
      11.93
    ],
    [
      1.121,
      -23.2536,
      -14.0822,
      12.08
    ],
    [
      1.141,
      -22.9911,
      -14.1979,
      12.22
    ],
    [
      1.161,
      -22.7285,
      -14.2931,
      12.35
    ],
    [
      1.181,
      -22.4659,
      -14.3951,
      12.48
    ],
    [
      1.201,
      -22.2033,
      -14.4972,
      12.6
    ],
    [
      1.221,
      -21.9303,
      -14.5924,
      12.71
    ],
    [
      1.241,
      -21.6887,
      -14.7081,
      12.82
    ],
    [
      1.261,
      -21.4156,
      -14.8033,
      12.93
    ],
    [
      1.281,
      -21.174,
      -14.9054,
      13.05
    ],
    [
      1.301,
      -20.943,
      -15.0074,
      13.17
    ],
    [
      1.321,
      -20.6909,
      -15.1163,
      13.29
    ],
    [
      1.341,
      -20.4283,
      -15.2251,
      13.38
    ],
    [
      1.361,
      -20.1868,
      -15.3272,
      13.48
    ],
    [
      1.381,
      -19.9767,
      -15.4224,
      13.6
    ],
    [
      1.401,
      -19.7456,
      -15.5244,
      13.7
    ],
    [
      1.421,
      -19.5146,
      -15.6265,
      13.8
    ],
    [
      1.441,
      -19.2835,
      -15.7353,
      13.89
    ],
    [
      1.461,
      -19.0524,
      -15.8374,
      13.98
    ],
    [
      1.481,
      -18.8214,
      -15.9326,
      14.07
    ],
    [
      1.501,
      -18.5903,